{
    "kodi": {
        "url": "http://localhost:8080",
        "username": "kodi",
        "password": "kodi",
        "_comment_instances": "multi-instance: add an 'instances' array of {url, username, password, self_signed_cert, name}; every instance is polled and whichever plays first owns the presence until it stops. When non-empty, the top-level url/username/password above are ignored.",
        "instances": [],
        "_comment_urls": "urls: alternate base URLs for one server (same credentials); each becomes a polled instance and trumps url. Also accepted per instances[] entry.",
        "urls": [],
        "music": {
            "display": ["genres"],
            "separator": "-"
        },
        "movies": {
            "display": ["genres"],
            "separator": "-"
        },
        "episodes": {
            "display": {
                "details_text": "{show-title}",
                "state_text": "S{season-padded}E{episode-padded} {title}",
                "image_text": "Kodi-RPC v{version}"
            },
            "separator": "-",
            "poster_source": "season"
        },
        "_comment_poster_source": "episodes poster_source: season (season poster, then series), series (series poster only), or episode (episode still, no poster lookups).",
        "unknown": {
            "display": {
                "details_text": "{title}",
                "state_text": "via {addon} {sep} {file-host}",
                "image_text": "Kodi-RPC v{version}"
            },
            "separator": "-"
        },
        "self_signed_cert": false,
        "show_simple": false,
        "append_prefix": false,
        "add_divider": false,
        "_comment": "blacklist libraries matches against Kodi file paths (substrings). Media types: music, movie, episode, livetv, unknown (aliases: audio/song/musicvideo, tvchannel/channel, plugin)",
        "blacklist": {
            "media_types": [],
            "libraries": []
        }
    },
    "discord": {
        "application_id": "1549062924545556480",
        "buttons": [
            {
                "name": "dynamic",
                "url": "dynamic"
            },
            {
                "name": "dynamic",
                "url": "dynamic"
            }
        ],
        "show_paused": true
    },
    "imgur": {
        "client_id": ""
    },
    "images": {
        "enable_images": true,
        "imgur_images": false,
        "litterbox_images": false,
        "tmpfiles_images": false,
        "process_images": true,
        "size": 512,
        "bg": true,
        "bg_blur": 3,
        "corner_radius": 4
    }
}
